{"actor_id":"fixture-author","created_at":"2026-09-08T00:00:00Z","disposition_id":"fixture-disposition","frame":{"path":"framing/problem_frame.json","sha256":"0000000000000000000000000000000000000000000000000000000000000000"},"items":[{"action":"retain_with_limit","boundary":"Structural fixture only; no scientific acceptance.","evidence_refs":["fixture-evidence"],"locator":"/issues/0","question_ids":["Q1"],"rationale":"Exercise explicit bounded use without claiming actual reasoning."}],"question_id":null,"schema_version":"2.0","source":{"path":"framing/deterministic_data_audit.json","sha256":"0000000000000000000000000000000000000000000000000000000000000000"},"source_kind":"data_audit"}
